dptm,name,img_name,position,clinic
혈액종양내과,김서리,가톨릭대학교 부천성모병원 혈액종양내과 김서리.png,교수,"고형암,혈액암, 혈액질환, 호스피스완화의료"
호흡기내과,권순석,가톨릭대학교 부천성모병원 호흡기내과 권순석.png,교수,"호흡기 및 폐암, 알레르기질환, 천식, 폐섬유화증, 만성폐쇄성폐질환"
호흡기내과,김용현,가톨릭대학교 부천성모병원 호흡기내과 김용현.png,교수,"호흡기 및 폐암, 알레르기질환, 천식, 폐섬유화증, 만성폐쇄성폐질환(매주 화요일 폐암협진으로 PM2시30분부터)"
호흡기내과,강혜선,가톨릭대학교 부천성모병원 호흡기내과 강혜선.png,교수,"폐암, 폐결절, 만성폐쇄성폐질환, 만성기침, 폐결핵"
호흡기내과,이응구,가톨릭대학교 부천성모병원 호흡기내과 이응구.png,교수,"만성폐쇄성폐질환, 천식, 기관지질환, 결핵, 폐렴, 기관지내시경"
호흡기내과,유지원,가톨릭대학교 부천성모병원 호흡기내과 유지원.png,교수,"중환자실 전담전문의(입원환자 협진의뢰 불가), 패혈증, 급성호흡곤란증후군, 만성기침, 호흡기 일반 질환"
호흡기알레르기내과,권순석,가톨릭대학교 부천성모병원 호흡기알레르기내과 권순석.png,교수,"호흡기 및 폐암, 알레르기 질환, 천식, 폐섬유화증, 만성폐쇄성 질환"
